{"authoredTier":"medium","blendMode":"additive","emitters":[{"color":{"stops":[{"color":{"a":0.95,"b":0.35,"g":0.85,"r":1},"t":0},{"color":{"a":0.85,"b":0.08,"g":0.42,"r":1},"t":0.45},{"color":{"a":0,"b":0.02,"g":0.05,"r":0.45},"t":1}]},"direction":{"x":0,"y":1,"z":0},"forces":[{"frequency":0.8,"intensity":0.7,"kind":"turbulence"}],"lifetime":{"points":[{"t":0,"value":1.1},{"t":1,"value":0.6}]},"maxParticles":220,"name":"flames","position":{"x":0,"y":0.4,"z":0},"rate":26,"size":{"points":[{"t":0,"value":0.9},{"t":0.4,"value":0.55},{"t":1,"value":0.08}]},"spawnShape":{"kind":"disc","radius":1.6},"speed":{"points":[{"t":0,"value":2.6},{"t":1,"value":0.7}]},"spread":0.35},{"color":{"stops":[{"color":{"a":0.5,"b":0.13,"g":0.14,"r":0.16},"t":0},{"color":{"a":0,"b":0.28,"g":0.29,"r":0.3},"t":1}]},"direction":{"x":0.15,"y":1,"z":0},"forces":[{"frequency":0.35,"intensity":0.4,"kind":"turbulence"}],"lifetime":{"points":[{"t":0,"value":4.5},{"t":1,"value":3}]},"maxParticles":90,"name":"smoke","position":{"x":0,"y":2.2,"z":0},"rate":7,"size":{"points":[{"t":0,"value":1.2},{"t":1,"value":4.2}]},"spawnShape":{"kind":"disc","radius":1.2},"speed":1.5,"spread":0.25},{"color":{"stops":[{"color":{"a":1,"b":0.15,"g":0.62,"r":1},"t":0},{"color":{"a":0,"b":0.02,"g":0.2,"r":0.8},"t":1}]},"direction":{"x":0,"y":1,"z":0},"forces":[{"frequency":1.4,"intensity":1.1,"kind":"turbulence"}],"lifetime":{"points":[{"t":0,"value":2.4},{"t":1,"value":1.2}]},"maxParticles":120,"name":"embers","position":{"x":0,"y":0.8,"z":0},"rate":10,"size":0.09,"spawnShape":{"kind":"sphere","radius":1.4},"speed":1.1,"spread":0.9}],"id":"shrine-fire","name":"Shrine of Fire — vent flames and smoke","version":1}