{"authoredTier":"medium","blendMode":"additive","emitters":[{"bursts":[{"count":30,"interval":1,"repeat":0,"time":0}],"color":{"stops":[{"color":{"a":1,"b":0.1,"g":0.6,"r":1},"t":0},{"color":{"a":0,"b":0,"g":0.1,"r":0.6},"t":1}]},"direction":{"x":0,"y":1,"z":0},"duration":1.5,"forces":[{"acceleration":{"x":0,"y":2,"z":0},"kind":"gravity"}],"lifetime":{"points":[{"t":0,"value":0.8},{"t":1,"value":1.2}]},"looping":false,"maxParticles":60,"name":"burst","position":{"x":0,"y":0,"z":0},"rate":0,"size":{"points":[{"t":0,"value":0.3},{"t":1,"value":0.05}]},"spawnShape":{"kind":"sphere","radius":0.3},"speed":{"points":[{"t":0,"value":8},{"t":1,"value":2}]},"spread":0.5}],"id":"fireball-impact","name":"Fireball Impact","version":1}