{"authoredTier":"medium","blendMode":"normal","emitters":[{"color":{"stops":[{"color":{"a":0.55,"b":0.09,"g":0.03,"r":0.05},"t":0},{"color":{"a":0.4,"b":0.14,"g":0.05,"r":0.09},"t":0.6},{"color":{"a":0,"b":0.07,"g":0.03,"r":0.04},"t":1}]},"direction":{"x":0.2,"y":0.1,"z":-0.3},"forces":[{"frequency":0.25,"intensity":0.2,"kind":"turbulence"}],"lifetime":{"points":[{"t":0,"value":6},{"t":1,"value":4}]},"maxParticles":100,"name":"dark-mist","position":{"x":0,"y":0.9,"z":0},"rate":8,"size":{"points":[{"t":0,"value":1.8},{"t":1,"value":4.4}]},"spawnShape":{"kind":"disc","radius":3},"speed":0.22,"spread":1.4},{"color":{"stops":[{"color":{"a":0.85,"b":0.62,"g":0.2,"r":0.38},"t":0},{"color":{"a":0.6,"b":0.4,"g":0.1,"r":0.22},"t":0.5},{"color":{"a":0,"b":0.16,"g":0.04,"r":0.08},"t":1}]},"direction":{"x":0,"y":-1,"z":0},"forces":[{"kind":"attractor","strength":0.35,"target":{"x":0,"y":0.4,"z":0}},{"frequency":0.7,"intensity":0.45,"kind":"turbulence"}],"lifetime":{"points":[{"t":0,"value":4.2},{"t":1,"value":2.8}]},"maxParticles":60,"name":"void-wisps","position":{"x":0,"y":2,"z":0},"rate":6,"size":{"points":[{"t":0,"value":0.3},{"t":1,"value":0.1}]},"spawnShape":{"kind":"sphere","radius":2.4},"speed":0.3,"spread":2.6}],"id":"shrine-darkness","name":"Shrine of Darkness — void wisps and dark mist","version":1}