{"authoredTier":"medium","blendMode":"normal","emitters":[{"color":{"stops":[{"color":{"a":0.95,"b":0.3,"g":0.72,"r":0.55},"t":0},{"color":{"a":0.85,"b":0.28,"g":0.68,"r":0.75},"t":0.6},{"color":{"a":0,"b":0.3,"g":0.55,"r":0.6},"t":1}]},"direction":{"x":0.85,"y":0.3,"z":0.35},"forces":[{"frequency":1.1,"intensity":1.6,"kind":"turbulence"},{"acceleration":{"x":0,"y":-0.5,"z":0},"kind":"gravity"}],"lifetime":{"points":[{"t":0,"value":2.6},{"t":1,"value":1.6}]},"maxParticles":170,"name":"leaf-swirl","position":{"x":0,"y":1,"z":0},"rate":20,"size":0.16,"spawnShape":{"kind":"disc","radius":3},"speed":2.1,"spread":1.9},{"color":{"stops":[{"color":{"a":0.7,"b":0.8,"g":0.95,"r":0.9},"t":0},{"color":{"a":0,"b":0.75,"g":0.9,"r":0.85},"t":1}]},"direction":{"x":0.9,"y":0.08,"z":0.3},"forces":[{"frequency":2.2,"intensity":0.8,"kind":"turbulence"}],"lifetime":{"points":[{"t":0,"value":1.4},{"t":1,"value":0.9}]},"maxParticles":110,"name":"grass-streaks","position":{"x":0,"y":0.6,"z":0},"rate":16,"size":0.05,"spawnShape":{"halfExtents":{"x":4,"y":0.5,"z":4},"kind":"box"},"speed":3.4,"spread":0.35}],"id":"shrine-wind","name":"Shrine of Wind — ridge leaf swirl","version":1}