{"authoredTier":"medium","blendMode":"normal","emitters":[{"color":{"stops":[{"color":{"a":0.4,"b":0.44,"g":0.6,"r":0.72},"t":0},{"color":{"a":0,"b":0.55,"g":0.7,"r":0.8},"t":1}]},"direction":{"x":0.7,"y":0.12,"z":0.2},"forces":[{"acceleration":{"x":0,"y":-0.25,"z":0},"kind":"gravity"},{"frequency":0.5,"intensity":0.3,"kind":"turbulence"}],"lifetime":{"points":[{"t":0,"value":3.8},{"t":1,"value":2.4}]},"maxParticles":160,"name":"dust-drift","position":{"x":0,"y":1.2,"z":0},"rate":14,"size":{"points":[{"t":0,"value":0.5},{"t":1,"value":1.7}]},"spawnShape":{"halfExtents":{"x":3.2,"y":1.4,"z":3.2},"kind":"box"},"speed":0.5,"spread":0.7},{"color":{"stops":[{"color":{"a":0.95,"b":0.36,"g":0.5,"r":0.62},"t":0},{"color":{"a":0.2,"b":0.3,"g":0.44,"r":0.55},"t":1}]},"direction":{"x":0,"y":-1,"z":0},"forces":[{"acceleration":{"x":0,"y":-3.2,"z":0},"kind":"gravity"}],"lifetime":{"points":[{"t":0,"value":1.6},{"t":1,"value":1}]},"maxParticles":80,"name":"falling-grit","position":{"x":0,"y":3.4,"z":0},"rate":8,"size":0.06,"spawnShape":{"kind":"disc","radius":2.2},"speed":0.4,"spread":0.3}],"id":"shrine-earth","name":"Shrine of Earth — quarry dust","version":1}