{"authoredTier":"medium","blendMode":"normal","emitters":[{"color":{"stops":[{"color":{"a":0.34,"b":0.92,"g":0.86,"r":0.75},"t":0},{"color":{"a":0,"b":0.97,"g":0.92,"r":0.85},"t":1}]},"direction":{"x":0.4,"y":0.25,"z":0.1},"forces":[{"frequency":0.3,"intensity":0.25,"kind":"turbulence"}],"lifetime":{"points":[{"t":0,"value":5},{"t":1,"value":3.4}]},"maxParticles":110,"name":"mist","position":{"x":0,"y":0.7,"z":0},"rate":9,"size":{"points":[{"t":0,"value":1.6},{"t":1,"value":4.6}]},"spawnShape":{"kind":"disc","radius":3.4},"speed":0.35,"spread":1.1},{"color":{"stops":[{"color":{"a":0.9,"b":1,"g":0.9,"r":0.65},"t":0},{"color":{"a":0,"b":0.95,"g":0.7,"r":0.4},"t":1}]},"direction":{"x":0,"y":1,"z":0},"forces":[{"frequency":0.9,"intensity":0.5,"kind":"turbulence"}],"lifetime":{"points":[{"t":0,"value":3.6},{"t":1,"value":2.2}]},"maxParticles":90,"name":"motes","position":{"x":0,"y":1,"z":0},"rate":12,"size":0.07,"spawnShape":{"kind":"sphere","radius":2.6},"speed":0.28,"spread":2.4}],"id":"shrine-water","name":"Shrine of Water — pond mist and motes","version":1}